{
  "schema": 1,
  "id": "app.autohost.sample.js-press-button",
  "name": "Press Button (JS)",
  "version": "1.0.0",
  "description": "The press-button archetype written in JavaScript — proves the third runtime end to end (Gate 11 F2). Same semantics as samples/press-button, JS surface only.",
  "host_api": ">=1 <2",
  "runtime": { "type": "javascript", "entry": "main.js" },
  "needs": {
    "capabilities": [
      { "id": "device.app.launch", "scope": { "packages": ["${config.target_package}"] } },
      { "id": "device.app.query", "scope": { "packages": ["${config.target_package}"] } },
      { "id": "device.ui.observe", "scope": { "packages": ["${config.target_package}"] } },
      { "id": "device.ui.act", "scope": { "packages": ["${config.target_package}"] } }
    ],
    "optional": [
      { "id": "device.screenshot", "scope": { "packages": ["${config.target_package}"] } }
    ],
    "apps": [ { "package": "${config.target_package}" } ]
  },
  "config_schema": {
    "type": "object",
    "required": ["target_package", "button_label"],
    "properties": {
      "target_package": { "type": "string", "title": "App", "x-ui": { "widget": "app-picker" } },
      "button_label": { "type": "string", "title": "Button text", "default": "Continue" },
      "label_variants": { "type": "array", "title": "Other languages / variants", "default": [] },
      "wait_seconds": { "type": "integer", "title": "Wait for button (s)", "default": 20, "minimum": 1, "maximum": 300 },
      "min_interval_minutes": { "type": "integer", "title": "Minimum gap between presses (min)", "default": 0, "minimum": 0 }
    }
  },
  "profile_schema": {
    "type": "object",
    "properties": {
      "label": { "type": "string", "title": "Profile name" },
      "target": { "type": "object", "title": "Instance", "x-ui": { "widget": "instance-target" } }
    }
  },
  "triggers": { "manual": true, "schedule": { "allowed": true, "default": { "type": "interval", "every_minutes": 30 } }, "events": [] },
  "execution": { "ui_exclusive": true, "needs_unlocked_screen": true, "pausable": true, "timeout_minutes": 5, "idle_timeout_seconds": 120, "max_attempts": 2, "verification": "final", "min_interval_minutes": 5 },
  "ui": { "mode": "auto" }
}
